<!ELEMENT szemelyek (szemely+)>
<!ELEMENT szemely (nev, kor, varos)>
<!ELEMENT nev (#PCDATA)>
<!ELEMENT kor (#PCDATA)>
<!ELEMENT varos (#PCDATA)>


<!ATTLIST szemely id ID #REQUIRED>
